[
  {
    "id": "term_aixterm",
    "Name": "aixterm",
    "ScopeClass": "historical_terminal_emulator",
    "Category": "X11_legacy",
    "rendering_generation": "cpu_classic",
    "ecosystem": "x11_xterm_family",
    "era": "legacy",
    "Arch": "native",
    "LayoutModel": "tabs",
    "RenderingSurface": "native_gui",
    "Status": "Legacy",
    "ActivitySignal": "archived",
    "DisplayDependency": "x11_required",
    "PrimaryConnection": "local",
    "MultiProtocol": false,
    "EmulationTarget": "vt_xterm",
    "CoreEngine": "custom",
    "EngineFamily": "xterm_lineage",
    "RenderingModel": "text_grid",
    "InteractionModel": "stream",
    "AbstractionLevel": "terminal_level",
    "Extensibility": "none",
    "StateModel": "stateless",
    "Confidence": "high",
    "Language": "C",
    "LanguageRole": "metadata_only",
    "MaturityScore": 1,
    "FirstReleaseYear": 1989,
    "LineageSoftware": "xterm",
    "LineageConcept": "xterm_compatibility;tabbed_terminal",
    "LineageConfidence": "high",
    "Notes": "xterm-compatible terminal emulator with tabs layout, native_gui surface.",
    "PrimarySource": "https://www.ibm.com/docs/en/aix",
    "LineageSoftware_list": [
      "xterm"
    ],
    "LineageConcept_list": [
      "xterm_compatibility",
      "tabbed_terminal"
    ]
  },
  {
    "id": "term_alacritty",
    "Name": "Alacritty",
    "ScopeClass": "unix_linux_terminal_emulator",
    "Category": "GPU_modern",
    "rendering_generation": "gpu_modern",
    "ecosystem": "standalone",
    "era": "modern",
    "Arch": "native",
    "LayoutModel": "none",
    "RenderingSurface": "native_gui",
    "Status": "Active",
    "ActivitySignal": "active",
    "DisplayDependency": "x11_compatible",
    "PrimaryConnection": "local",
    "MultiProtocol": false,
    "EmulationTarget": "vt_xterm",
    "CoreEngine": "custom",
    "EngineFamily": "custom_gpu",
    "RenderingModel": "gpu_cells",
    "InteractionModel": "stream",
    "AbstractionLevel": "terminal_level",
    "Extensibility": "config",
    "StateModel": "stateless",
    "Confidence": "high",
    "Language": "Rust",
    "LanguageRole": "metadata_only",
    "MaturityScore": 3,
    "FirstReleaseYear": 2016,
    "LineageSoftware": "custom_root",
    "LineageConcept": "xterm_compatibility;gpu_acceleration;configuration_driven",
    "LineageConfidence": "high",
    "Notes": "GPU-accelerated terminal emulator focused on simple native rendering and high throughput.",
    "PrimarySource": "https://github.com/alacritty/alacritty",
    "LineageSoftware_list": [
      "custom_root"
    ],
    "LineageConcept_list": [
      "xterm_compatibility",
      "gpu_acceleration",
      "configuration_driven"
    ]
  },
  {
    "id": "term_aterm",
    "Name": "aterm",
    "ScopeClass": "historical_terminal_emulator",
    "Category": "X11_legacy",
    "rendering_generation": "cpu_classic",
    "ecosystem": "x11_xterm_family",
    "era": "legacy",
    "Arch": "native",
    "LayoutModel": "none",
    "RenderingSurface": "native_gui",
    "Status": "Legacy",
    "ActivitySignal": "archived",
    "DisplayDependency": "x11_required",
    "PrimaryConnection": "local",
    "MultiProtocol": false,
    "EmulationTarget": "vt_xterm",
    "CoreEngine": "custom",
    "EngineFamily": "rxvt_lineage",
    "RenderingModel": "text_grid",
    "InteractionModel": "stream",
    "AbstractionLevel": "terminal_level",
    "Extensibility": "config",
    "StateModel": "stateless",
    "Confidence": "high",
    "Language": "C",
    "LanguageRole": "metadata_only",
    "MaturityScore": 1,
    "FirstReleaseYear": 1998,
    "LineageSoftware": "rxvt;xterm",
    "LineageConcept": "xterm_compatibility;rxvt_minimalism;configuration_driven",
    "LineageConfidence": "high",
    "Notes": "xterm-compatible terminal emulator with native_gui surface, config extensibility.",
    "PrimarySource": "https://sourceforge.net/projects/aterm/",
    "LineageSoftware_list": [
      "rxvt",
      "xterm"
    ],
    "LineageConcept_list": [
      "xterm_compatibility",
      "rxvt_minimalism",
      "configuration_driven"
    ]
  },
  {
    "id": "term_black_box",
    "Name": "Black Box",
    "ScopeClass": "unix_linux_terminal_emulator",
    "Category": "VTE_ecosystem",
    "rendering_generation": "cpu_classic",
    "ecosystem": "vte",
    "era": "modern",
    "Arch": "native",
    "LayoutModel": "tabs",
    "RenderingSurface": "native_gui",
    "Status": "Active",
    "ActivitySignal": "active",
    "DisplayDependency": "x11_compatible",
    "PrimaryConnection": "local",
    "MultiProtocol": false,
    "EmulationTarget": "vt_xterm",
    "CoreEngine": "VTE",
    "EngineFamily": "VTE_wrapper",
    "RenderingModel": "text_grid",
    "InteractionModel": "stream",
    "AbstractionLevel": "terminal_level",
    "Extensibility": "config",
    "StateModel": "stateless",
    "Confidence": "high",
    "Language": "Vala",
    "LanguageRole": "metadata_only",
    "MaturityScore": 3,
    "FirstReleaseYear": 2021,
    "LineageSoftware": "VTE",
    "LineageConcept": "xterm_compatibility;tabbed_terminal;desktop_integration;configuration_driven",
    "LineageConfidence": "high",
    "Notes": "GTK/VTE terminal emulator with tabs layout, native_gui surface, config extensibility.",
    "PrimarySource": "https://gitlab.gnome.org/raggesilver/blackbox",
    "LineageSoftware_list": [
      "VTE"
    ],
    "LineageConcept_list": [
      "xterm_compatibility",
      "tabbed_terminal",
      "desktop_integration",
      "configuration_driven"
    ]
  },
  {
    "id": "term_cantera_term",
    "Name": "Cantera Term",
    "ScopeClass": "unix_linux_terminal_emulator",
    "Category": "Experimental_UI",
    "rendering_generation": "mixed_or_experimental",
    "ecosystem": "experimental_ui",
    "era": "modern",
    "Arch": "native",
    "LayoutModel": "none",
    "RenderingSurface": "native_gui",
    "Status": "Experimental",
    "ActivitySignal": "dormant",
    "DisplayDependency": "x11_compatible",
    "PrimaryConnection": "local",
    "MultiProtocol": false,
    "EmulationTarget": "vt_xterm",
    "CoreEngine": "custom",
    "EngineFamily": "custom_native",
    "RenderingModel": "text_grid",
    "InteractionModel": "stream",
    "AbstractionLevel": "terminal_level",
    "Extensibility": "none",
    "StateModel": "stateless",
    "Confidence": "low",
    "Language": null,
    "LanguageRole": "metadata_only",
    "MaturityScore": 0,
    "FirstReleaseYear": 2019,
    "LineageSoftware": "custom_root",
    "LineageConcept": "xterm_compatibility",
    "LineageConfidence": "inferred",
    "Notes": "terminal emulator with native_gui surface.",
    "PrimarySource": "https://gitlab.com/alexanderalemayhu/cantera-term",
    "LineageSoftware_list": [
      "custom_root"
    ],
    "LineageConcept_list": [
      "xterm_compatibility"
    ]
  },
  {
    "id": "term_color_xterm",
    "Name": "color-xterm",
    "ScopeClass": "historical_terminal_emulator",
    "Category": "X11_legacy",
    "rendering_generation": "cpu_classic",
    "ecosystem": "x11_xterm_family",
    "era": "legacy",
    "Arch": "native",
    "LayoutModel": "tabs",
    "RenderingSurface": "native_gui",
    "Status": "Legacy",
    "ActivitySignal": "archived",
    "DisplayDependency": "x11_compatible",
    "PrimaryConnection": "local",
    "MultiProtocol": false,
    "EmulationTarget": "vt_xterm",
    "CoreEngine": "custom",
    "EngineFamily": "xterm_lineage",
    "RenderingModel": "text_grid",
    "InteractionModel": "stream",
    "AbstractionLevel": "terminal_level",
    "Extensibility": "none",
    "StateModel": "stateless",
    "Confidence": "medium",
    "Language": "C",
    "LanguageRole": "metadata_only",
    "MaturityScore": 1,
    "FirstReleaseYear": 1992,
    "LineageSoftware": "xterm",
    "LineageConcept": "xterm_compatibility;tabbed_terminal",
    "LineageConfidence": "inferred",
    "Notes": "xterm-compatible terminal emulator with tabs layout, native_gui surface.",
    "PrimarySource": "https://invisible-island.net/xterm/",
    "LineageSoftware_list": [
      "xterm"
    ],
    "LineageConcept_list": [
      "xterm_compatibility",
      "tabbed_terminal"
    ]
  },
  {
    "id": "term_contour",
    "Name": "Contour",
    "ScopeClass": "unix_linux_terminal_emulator",
    "Category": "GPU_modern",
    "rendering_generation": "gpu_modern",
    "ecosystem": "standalone",
    "era": "modern",
    "Arch": "native",
    "LayoutModel": "tabs",
    "RenderingSurface": "native_gui",
    "Status": "Active",
    "ActivitySignal": "active",
    "DisplayDependency": "x11_compatible",
    "PrimaryConnection": "local",
    "MultiProtocol": false,
    "EmulationTarget": "vt_xterm",
    "CoreEngine": "custom",
    "EngineFamily": "custom_gpu",
    "RenderingModel": "gpu_cells",
    "InteractionModel": "stream",
    "AbstractionLevel": "terminal_level",
    "Extensibility": "config",
    "StateModel": "stateless",
    "Confidence": "high",
    "Language": "C++",
    "LanguageRole": "metadata_only",
    "MaturityScore": 3,
    "FirstReleaseYear": 2020,
    "LineageSoftware": "custom_root",
    "LineageConcept": "xterm_compatibility;tabbed_terminal;gpu_acceleration;configuration_driven",
    "LineageConfidence": "high",
    "Notes": "GPU-accelerated terminal emulator with tabs layout, native_gui surface, config extensibility.",
    "PrimarySource": "https://github.com/contour-terminal/contour",
    "LineageSoftware_list": [
      "custom_root"
    ],
    "LineageConcept_list": [
      "xterm_compatibility",
      "tabbed_terminal",
      "gpu_acceleration",
      "configuration_driven"
    ]
  },
  {
    "id": "term_cool_retro_term",
    "Name": "Cool Retro Term",
    "ScopeClass": "unix_linux_terminal_emulator",
    "Category": "Experimental_UI",
    "rendering_generation": "mixed_or_experimental",
    "ecosystem": "experimental_ui",
    "era": "modern",
    "Arch": "native",
    "LayoutModel": "none",
    "RenderingSurface": "native_gui",
    "Status": "Maintenance",
    "ActivitySignal": "dormant",